"Code","Symbol","Industry","Board"
":KOZAA-E.TR","KOZA ANADOLU METAL MADENCILIK ISLETMELERI A.S.","Unknown","IST"
"ACSEL.TR","Aciselsan Acipayam Seluloz Sanayi","Unknown","IST"
"ADANA.TR","Adana Cimento Sanayii T.A.S.","Unknown","IST"
"ADBGR.TR","Adana Cimento Sanayii T.A.S.","Unknown","IST"
"ADEL.TR","Adel Kalemcilik Ticaret ve Sanayi A.S.","Unknown","IST"
"ADESE.TR","Adese Alisveris Merkezleri Ticaret AS","Unknown","IST"
"ADNAC.TR","Adana Cimento Sanayii T.A.S.","Unknown","IST"
"AEFES.TR","Anadolu Efes Biracilik ve Malt Sanayi AS","Unknown","IST"
"AFMAS.TR","Afm Uluslrs Film Prdksyn Tcrt ve Sny AS","Unknown","IST"
"AFYON.TR","Afyon Cimento Sanayi T.A.S.","Unknown","IST"
"AGYO.TR","Atakule Gayrimenkul Yatirim Ortakligi AS","Unknown","IST"
"AKBNK.TR","Akbank T.A.S.","Unknown","IST"
"AKCNS.TR","Akcansa Cimento Sanayi Ve Ticaret A.S.","Unknown","IST"
"AKENR.TR","Akenerji Elektrik Uretim A.S.","Unknown","IST"
"AKFEN.TR","Akfen Holding AS","Unknown","IST"
"AKFGY.TR","Akfen Gayrimenkul Yatirim Ortakligi AS","Unknown","IST"
"AKGRT.TR","Aksigorta A.S.","Unknown","IST"
"AKGUV.TR","Akdeniz Guvenlik Hizmetleri AS","Unknown","IST"
"AKMGY.TR","Akmerkez Gayrimenkul Yatirim Ort. A.S.","Unknown","IST"
"AKPAZ.TR","Akyurek Tuketim Urunleri Pazar Dag ve","Unknown","IST"
"AKSA.TR","Aksa Akrilik Kimya Sanayii AS","Unknown","IST"
"AKSEL.TR","Aksel Yatirim Holding AS","Unknown","IST"
"AKSEN.TR","Aksa Enerji Uretim AS","Unknown","IST"
"AKSGY.TR","AKIS GMYO","Unknown","IST"
"AKSUE.TR","Aksu Enerji ve Ticaret A.S.","Unknown","IST"
"ALARK.TR","Alarko Holding A.S.","Unknown","IST"
"ALBRK.TR","Albaraka Turk Katilim Bankasi AS","Unknown","IST"
"ALCAR.TR","Alarko Carrier Sanayi ve Ticaret AS","Unknown","IST"
"ALCTL.TR","Alcatel Lucent Teletas Telekomunikasyon","Unknown","IST"
"ALGYO.TR","Alarko Gayrimenkul Yatirim Ortakligi AS","Unknown","IST"
"ALKA.TR","Alkim Kagit Sanayi ve Ticaret A.S.","Unknown","IST"
"ALKIM.TR","Alkim Alkali Kimya A.S.","Unknown","IST"
"ALNTF.TR","Alternatifbank A.S.","Unknown","IST"
"ALYAG.TR","Altinyag Kombinalari A.S.","Unknown","IST"
"ANACM.TR","Anadolu Cam Sanayii A.S.","Unknown","IST"
"ANELE.TR","Anel Elektrik Proje Taahhut ve Tic. A.S.","Unknown","IST"
"ANELT.TR","Anel Telekomunikasyon Elektronik Sist.","Unknown","IST"
"ANHYT.TR","Anadolu Hayat Emeklilik AS","Unknown","IST"
"ANSA.TR","Ansa Yatirim Holding AS","Unknown","IST"
"ANSGR.TR","Anadolu Anonim Turk Sigorta Sirketi","Unknown","IST"
"ARBUL.TR","Arbul Entegre Tekstil Isletmeleri AS","Unknown","IST"
"ARCLK.TR","Arcelik AS","Unknown","IST"
"ARENA.TR","Arena Bilgisayar Sanayi ve Ticaret AS","Unknown","IST"
"ARFYO.TR","Alternatif Yatirim Ortakligi A.S.","Unknown","IST"
"ARMDA.TR","Armada Blgsyr Stmlr Sny ve Tcrt AS","Unknown","IST"
"ARSAN.TR","Arsan Tekstil Ticaret ve Sanayi A.S.","Unknown","IST"
"ARTI.TR","Arti Yatirim Holding AS","Unknown","IST"
"ARTOG.TR","Ar Tarim Organik Gida AS","Unknown","IST"
"ASCEL.TR","ASIL CELIK","Unknown","IST"
"ASELS.TR","Aselsan Elektronik Sanayi ve Ticaret AS","Unknown","IST"
"ASLAN.TR","Aslan Cimento AS","Unknown","IST"
"ASUZU.TR","Anadolu Isuzu Otomotiv Sanayii v Tcrt AS","Unknown","IST"
"ASYAB.TR","Asya Katilim Bankasi A.S.","Unknown","IST"
"ATAC.TR","Atac Insaat ve Sanayi AS","Unknown","IST"
"ATAGY.TR","Ata Gayrimenkul Yatirim Ortakligi AS","Unknown","IST"
"ATEKS.TR","Akin Tekstil AS","Unknown","IST"
"ATLAS.TR","Atlas Menkul Kiymetler Yatirim Ortakligi","Unknown","IST"
"ATPET.TR","Atlantik Petrol Urnlr Tcrt ve SAS","Unknown","IST"
"ATSYH.TR","Atlantis Yatirim Holding AS","Unknown","IST"
"AVGYO.TR","Avrasya Menkul Kiymetler Yatirim Ortak.","Unknown","IST"
"AVHOL.TR","Avrupa Yatirim Holding AS","Unknown","IST"
"AVISA.TR","AvivaSA Emeklilik ve Hayat AS","Unknown","IST"
"AVOD.TR","AVOD Kurutulmus Gida ve Tarim","Unknown","IST"
"AVTUR.TR","Avrasya Petrol ve Turistik Tslr Ytrmr AS","Unknown","IST"
"AYCES.TR","Altin Yunus Cesme Turistik Tesisler A.S.","Unknown","IST"
"AYEN.TR","Ayen Enerji A.S.","Unknown","IST"
"AYES.TR","AYES CELIK HASIR VE CIT","Unknown","IST"
"AYGAZ.TR","Aygaz AS","Unknown","IST"
"BAGFS.TR","Bagfas Bandirma Gubre Fabrikalari A.S.","Unknown","IST"
"BAKAB.TR","Bak Ambalaj Sanayi ve Ticaret A.S.","Unknown","IST"
"BAKAN.TR","Bakanlar Medya AS","Unknown","IST"
"BALAT.TR","BALATACILAR BALATACILIK","Unknown","IST"
"BANVT.TR","Banvit Bandirma Vitaminli Yem Sanayii","Unknown","IST"
"BASCM.TR","BASTAS BASKENT CIMENTO","Unknown","IST"
"BERDN.TR","Berdan Tekstil Sanayi ve Ticaret A.S.","Unknown","IST"
"BEYAZ.TR","Beyaz Filo Oto Kiralama AS","Unknown","IST"
"BFREN.TR","Bosch Fren Sistemleri San. ve Tic. A.S.","Unknown","IST"
"BIMAS.TR","BIM Birlesik Magazalar A.S.","Unknown","IST"
"BISAS.TR","Bisas Tekstil Sanayi ve Ticaret AS","Unknown","IST"
"BIZIM.TR","Bizim Toptan Satis Magazalari AS","Unknown","IST"
"BJKAS.TR","Besiktas Futbol Yatirimlar Sny v Tcrt AS","Unknown","IST"
"BLCYT.TR","Bilici Yatirim Sanayi ve Ticaret AS","Unknown","IST"
"BMEKS.TR","Bimeks Bilgi Islem ve Dis Ticaret AS","Unknown","IST"
"BMELK.TR","Bomonti Elektrik Muhendislik Msvk ITvTAS","Unknown","IST"
"BNKTR.TR","TURKEY LARGE-CAP BANKS ETF","Unknown","IST"
"BNTAS.TR","Bantas Bandirma Ambalaj Sanayi ve Ticare","Unknown","IST"
"BOLUC.TR","Bolu Cimento Sanayii A.S.","Unknown","IST"
"BOSSA.TR","Bossa Ticaret ve Sanayi Isletmeleri TAS","Unknown","IST"
"BOYNR.TR","Boyner Buyuk Magazacilik AS","Unknown","IST"
"BOYP.TR","Boyner Perakende Ve Tekstil Yatirimlr AS","Unknown","IST"
"BRISA.TR","Brisa Bridgestone Sabanci Lastik San.","Unknown","IST"
"BRKO.TR","Birko Birlesik Koyunlulular Mensucat Tic","Unknown","IST"
"BRKSN.TR","Berkosan Yalitim ve Tecrit Maddeleri","Unknown","IST"
"BRMEN.TR","Birlik Mensucat Tic. ve San. Isletmesi","Unknown","IST"
"BRSAN.TR","Borusan Mannesmann Boru Sanayi v Tcrt AS","Unknown","IST"
"BRYAT.TR","Borusan Yatirim ve Pazarlama AS","Unknown","IST"
"BSHEV.TR","BSH Ev Aletleri Sanayi ve Ticaret AS","Unknown","IST"
"BSOKE.TR","Batisoke Soke Cimento Sanayii T.A.S.","Unknown","IST"
"BTCIM.TR","Baticim Bati Anadolu Cimento Sanayii AS","Unknown","IST"
"BUCIM.TR","Bursa Cimento Fabrikasi A.S.","Unknown","IST"
"BURCE.TR","Burcelik Bursa Celik Dokum Sanayii A.S.","Unknown","IST"
"BURVA.TR","Burcelik Vana Sanayi ve Ticaret A.S.","Unknown","IST"
"CBSBO.TR","CBS Boya Kimya Sanayii ve Ticaret A.S.","Unknown","IST"
"CCOLA.TR","Coca Cola Icecek AS","Unknown","IST"
"CELHA.TR","Celik Halat ve Tel Sanayii A.S.","Unknown","IST"
"CEMAS.TR","Cemas Dokum Sanayi AS","Unknown","IST"
"CEMTS.TR","Cemtas Celik Makina Sanayi ve Ticaret AS","Unknown","IST"
"CIMSA.TR","Cimsa Cimento Sanayi ve Ticaret A.S.","Unknown","IST"
"CLEBI.TR","Celebi Hava Servisi A.S.","Unknown","IST"
"CLKHO.TR","CLK Holding AS","Unknown","IST"
"CMBTN.TR","Cimbeton Hazir Beton ve Prefabrik Yapi","Unknown","IST"
"CMENT.TR","Cimentas Izmir Cimento Fabrikasi Turk AS","Unknown","IST"
"COMDO.TR","Componenta Dokumculuk Ticaret ve Sny AS","Unknown","IST"
"COSMO.TR","Cosmos Yatirim Holding AS","Unknown","IST"
"CRDFA.TR","Creditwest Faktoring AS","Unknown","IST"
"CRFSA.TR","Carrefoursa Carrefour Sabanci Tic. Merk.","Unknown","IST"
"CUSAN.TR","Cuhadaroglu Metal Sanayi ve Pazarlama AS","Unknown","IST"
"DAGHL.TR","Dagi Yatirim Holding AS","Unknown","IST"
"DAGI.TR","Dagi Giyim Sanayi ve Ticaret AS","Unknown","IST"
"DARDL.TR","Dardanel Onentas Gida Sanayi AS","Unknown","IST"
"DENCM.TR","Denizli Cam Sanayi ve Ticaret AS","Unknown","IST"
"DENGE.TR","Denge Yatirim Holding AS","Unknown","IST"
"DENIZ.TR","Denizbank A.S.","Unknown","IST"
"DENTA.TR","Dentas Ambalaj ve Kagit Sanayi A.S.","Unknown","IST"
"DERIM.TR","Derimod Konfeksyn Aykkb Dr Sny v Tcrt AS","Unknown","IST"
"DESA.TR","Desa Deri Sanayi ve Ticaret A.S.","Unknown","IST"
"DESPC.TR","Despec Bilgisayar Pazarlama v Ticaret AS","Unknown","IST"
"DEVA.TR","Deva Holding AS","Unknown","IST"
"DGATE.TR","Datagate Bilgisayar Malzemeleri Ticrt AS","Unknown","IST"
"DGGYO.TR","Dogus Gayrimenkul Yatirim Ortakligi AS","Unknown","IST"
"DGKLB.TR","Dogtas Kelebek Mobilya Sanayi ve Tcrt AS","Unknown","IST"
"DGZTE.TR","Dogan Gazetecilik A.S.","Unknown","IST"
"DIRIT.TR","DIRITEKS DIRILIS TEKSTIL","Unknown","IST"
"DITAS.TR","Ditas Dogan Yedek Parca Imalat ve Teknik","Unknown","IST"
"DJIMT.TR","BIZIM MENKUL DEGERDJIM TURKEY ETF","Unknown","IST"
"DJIST.TR","DOW JONES ISTANBUL 20 ETF","Unknown","IST"
"DMSAS.TR","Demisas Dokum Emaye Mamulleri Sanayi AS","Unknown","IST"
"DOAS.TR","Dogus Otomotiv Servis ve Ticaret A.S.","Unknown","IST"
"DOBUR.TR","Dogan Burda Dergi Yayincilik ve Pzrlm AS","Unknown","IST"
"DOCO.TR","DO & CO AG - Istanbul listing","Unknown","IST"
"DOGUB.TR","Dogusan Boru Sanayi ve Ticaret A.S.","Unknown","IST"
"DOHOL.TR","Dogan Sirketler Grubu Holding AS","Unknown","IST"
"DURDO.TR","Duran Dogan Basim ve Ambalaj San. A.S","Unknown","IST"
"DYHOL.TR","Dogan Yayin Holding AS","Unknown","IST"
"DYOBY.TR","Dyo Boya Fabrikalari Sanayi ve Tic. A.S.","Unknown","IST"
"DZGYO.TR","Deniz Gayrimenkul Yatirim Ortakligi AS","Unknown","IST"
"ECBYO.TR","Eczacibasi Yatirim Ortakligi A.S.","Unknown","IST"
"ECILC.TR","EIS Eczacibs Ilc Sn Fnsl Ytrmlr Sny Tcrt","Unknown","IST"
"ECYAP.TR","Eczacibasi Yapi Gerecleri San. ve T.A.S.","Unknown","IST"
"ECZYT.TR","Eczacibasi Yatirim Holding Ortakligi AS","Unknown","IST"
"EDIP.TR","Edip Gayrimenkul Yatirim Sny ve Tcrt AS","Unknown","IST"
"EGCYH.TR","Egeli & Co Yatirim Holding AS","Unknown","IST"
"EGCYO.TR","Egeli & Co Tarim Grsm Srmys Ytrm Ortk AS","Unknown","IST"
"EGEEN.TR","Ege Endustri ve Ticaret AS","Unknown","IST"
"EGGUB.TR","Ege Gubre Sanayii A.S.","Unknown","IST"
"EGLYO.TR","Egeli & Co Girisim Sermayesi Yat Ort AS","Unknown","IST"
"EGPRO.TR","Ege Profil Ticaret ve Sanayi A.S.","Unknown","IST"
"EGSER.TR","Ege Seramik Sanayi ve Ticaret AS","Unknown","IST"
"EGYO.TR","EGS Gayrimenkul Yatirim Ortakligi AS","Unknown","IST"
"EKGYO.TR","Emlak Konut Gayrimenkul Yatirim Ortak AS","Unknown","IST"
"EKIZ.TR","Ekiz Kimya Sanayi ve Ticaret AS","Unknown","IST"
"EMKEL.TR","Emek Elektrik Endustrisi A.S.","Unknown","IST"
"EMNIS.TR","Eminis Ambalaj Sanayi ve Ticaret AS","Unknown","IST"
"ENKAI.TR","Enka Insaat ve Sanayi A.S.","Unknown","IST"
"EPLAS.TR","Egeplast Ege Plastik Tic. ve San. A.S.","Unknown","IST"
"ERBOS.TR","Erbosan Erciyas Boru Sanayii ve Tic. AS","Unknown","IST"
"EREGL.TR","Eregli Demir ve Celik Fabrikalari T.A.S.","Unknown","IST"
"ERICO.TR","Ericom Telekomunikasyn v Enrj Tknljlr AS","Unknown","IST"
"ERSU.TR","Ersu Meyve ve Gida Sanayi AS","Unknown","IST"
"ESCOM.TR","Escort Teknoloji Yatirim AS","Unknown","IST"
"ESEMS.TR","Esem Spor Giyim Sanayi ve Ticaret A.S.","Unknown","IST"
"ETILR.TR","Etiler Gida ve Tcr Ytrmr Sny ve Tcrt AS","Unknown","IST"
"ETYAT.TR","Euro Trend Yatirim Ortakligi A.S.","Unknown","IST"
"EUHOL.TR","Euro Yatirim Holding AS","Unknown","IST"
"EUKYO.TR","Euro Kapital Yatirim Ortakligi AS","Unknown","IST"
"EUYO.TR","Euro Menkul Kiymet Yatirim Ortakligi AS","Unknown","IST"
"FBIST.TR","FINANSBANK FTSE ISTANBUL BOND ETF","Unknown","IST"
"FENER.TR","Fenerbahce Futbol AS","Unknown","IST"
"FENIS.TR","Fenis Aluminyum Sanayi ve Ticaret A.S.","Unknown","IST"
"FFKRL.TR","Finans Finansal Kiralama A.S.","Unknown","IST"
"FINBN.TR","Finansbank A.S.","Unknown","IST"
"FLAP.TR","FLAP Kongre Tplnti Hzmtlri Otmtv ve Trzm","Unknown","IST"
"FMIZP.TR","Federal-Mogul Izmit Piston ve Pim Uretim","Unknown","IST"
"FNSYO.TR","Finans Yatirim Ortakligi AS","Unknown","IST"
"FRIGO.TR","Frigo Pak Gida Maddeleri Sanayi ve Tic.","Unknown","IST"
"FROTO.TR","Ford Otomotiv Sanayi AS","Unknown","IST"
"FVORI.TR","Favori Dinlenme Yerleri A.S.","Unknown","IST"
"GARAN.TR","Turkiye Garanti Bankasi A.S.","Unknown","IST"
"GAREN.TR","MSCI TURKEY INDEX ETF","Unknown","IST"
"GARFA.TR","Garanti Faktoring AS","Unknown","IST"
"GARON.TR","IST:GARON","Unknown","IST"
"GDKGS.TR","Gedik Girisim Sermayesi Yatirim Ortaklig","Unknown","IST"
"GEDIK.TR","Gedik Yatirim Menkul Degerler AS","Unknown","IST"
"GEDIZ.TR","Gimsan Gediz Iplik ve Mensucat Sanayi AS","Unknown","IST"
"GEDZA.TR","GEDIZ AMBALAJ","Unknown","IST"
"GENTS.TR","Gentas Genel Metal Sanayi ve Ticaret A.S","Unknown","IST"
"GENYH.TR","Gen Yatirim Holding AS","Unknown","IST"
"GEREL.TR","Gersan Elektrik Tic. ve San. A.S.","Unknown","IST"
"GLBMD.TR","Global Menkul Degerler AS","Unknown","IST"
"GLDTR.TR","ISTANBUL GOLD ETF","Unknown","IST"
"GLRYH.TR","Guler Yatirim Holding AS","Unknown","IST"
"GLYHO.TR","Global Yatirim Holding A.S.","Unknown","IST"
"GMSTR.TR","IST:GMSTR","Unknown","IST"
"GNPWR.TR","Genpower Holding AS","Unknown","IST"
"GOLDP.TR","GOLD ETF TYPE B","Unknown","IST"
"GOLTS.TR","Goltas Goller Bolgesi Cimento Sanayi","Unknown","IST"
"GOODY.TR","Goodyear Lastikleri T.A.S.","Unknown","IST"
"GOZDE.TR","Gozde Girisim Sermayesi Yatirm Ortklg AS","Unknown","IST"
"GRNYO.TR","Garanti Yatirim Ortakligi A.S.","Unknown","IST"
"GSDDE.TR","GSD Denizcilik Gyrmnk Inst Sny v Tcrt AS","Unknown","IST"
"GSDHO.TR","GSD Holding AS","Unknown","IST"
"GSRAY.TR","Galatasaray Sportif Sinai ve Ticari Yat.","Unknown","IST"
"GUBRF.TR","Gubre Fabrikalari T.A.S.","Unknown","IST"
"GUSGR.TR","Gunes Sigorta AS","Unknown","IST"
"GYHOL.TR","Gedik Yatirim Holding AS","Unknown","IST"
"HALKB.TR","Turkiye Halk Bankasi A.S.","Unknown","IST"
"HALKS.TR","Halk Sigorta AS","Unknown","IST"
"HATEK.TR","Hateks Hatay Tekstil Isletmeleri AS","Unknown","IST"
"HDFGS.TR","Hedef Girisim Sermayesi Yatirim Ortk AS","Unknown","IST"
"HEKTS.TR","Hektas Ticaret A.S.","Unknown","IST"
"HITIT.TR","Hitit Holding AS","Unknown","IST"
"HLGYO.TR","Halk Gayrimenkul Yatirim Ortakligi AS","Unknown","IST"
"HURGZ.TR","Hurriyet Gazetecilik ve Matbaacilik A.S.","Unknown","IST"
"HZNDR.TR","Haznedar Refrakter Sanayii AS","Unknown","IST"
"ICBCT.TR","ICBC Turkey Bank AS","Unknown","IST"
"IDAS.TR","Idas Istanbul Doseme Sanayii A.S.","Unknown","IST"
"IDGYO.TR","Idealist Gayrimenkul Yatirim Ortakli AS","Unknown","IST"
"IEYHO.TR","Isiklar Enerji ve Yapi Holding AS","Unknown","IST"
"IHEVA.TR","Ihlas Ev Aletleri Imalat San. ve Tic. AS","Unknown","IST"
"IHGZT.TR","Ihlas Gazetecilik AS","Unknown","IST"
"IHLAS.TR","Ihlas Holding AS","Unknown","IST"
"IHMAD.TR","Ihlas Madencilik AS","Unknown","IST"
"IHYAY.TR","Ihlas Yayin Holding AS","Unknown","IST"
"INDES.TR","Indeks Bilgisayar Sistemleri Muhendislik","Unknown","IST"
"INFO.TR","Info Yatirim AS","Unknown","IST"
"INTEM.TR","Intema Insaat ve Tesisat Malzemeleri","Unknown","IST"
"IPEKE.TR","Ipek Dogal Enerj Kynklr Arstrm v Urtm AS","Unknown","IST"
"ISATR.TR","Turkiye Is Bankasi A.S.","Unknown","IST"
"ISBIR.TR","ISBIR HOLDING","Unknown","IST"
"ISBTR.TR","Turkiye Is Bankasi A.S.","Unknown","IST"
"ISCTR.TR","Turkiye Is Bankasi A.S.","Unknown","IST"
"ISDMR.TR","ISKENDERUN DEMIR CELIK","Unknown","IST"
"ISFIN.TR","Is Finansal Kiralama AS","Unknown","IST"
"ISGSY.TR","Is Girisim Sermayesi Yatirim Ort. A.S.","Unknown","IST"
"ISGYO.TR","Is Gayrimenkul Yatirim Ortakligi AS","Unknown","IST"
"ISKUR.TR","Turkiye Is Bankasi A.S.","Unknown","IST"
"ISMEN.TR","Is Yatirim Menkul Degerler AS","Unknown","IST"
"IST30.TR","ISE 30 ETF","Unknown","IST"
"ISUVT.TR","IS YATIRIM MENKUL IS INV TURK BENCHM BOND ETF","Unknown","IST"
"ISY30.TR","IS YATIRIM IMKB 30 A TIPI BORSA ETF","Unknown","IST"
"ISYAT.TR","Is Yatirim Ortakligi AS","Unknown","IST"
"ISYHO.TR","Isiklar Yatirim Holding AS","Unknown","IST"
"ITTFH.TR","Ittifak Holding AS","Unknown","IST"
"IZFAS.TR","Izmir Firca Sanayi ve Ticaret AS","Unknown","IST"
"IZMDC.TR","Izmir Demir Celik Sanayi A.S.","Unknown","IST"
"IZOCM.TR","Izocam Ticaret ve Sanayi A.S.","Unknown","IST"
"IZTAR.TR","Iz Hayvancilik Tarim ve Gida Sanayi","Unknown","IST"
"JANTS.TR","Jantsa Jant Sanayi ve Ticaret AS","Unknown","IST"
"KAPLM.TR","Kaplamin Ambalaj Sanayi ve Ticaret A.S.","Unknown","IST"
"KAREL.TR","Karel Elektronik Sanayi ve Ticaret A.S.","Unknown","IST"
"KARSN.TR","Karsan Otomotiv Sanayii Ve Ticaret A.S.","Unknown","IST"
"KARTN.TR","Kartonsan Karton Sanayi ve Ticaret A.S.","Unknown","IST"
"KATMR.TR","Katmerciler Arac Ustu Ekipm San ve Ti AS","Unknown","IST"
"KCHOL.TR","Koc Holding AS","Unknown","IST"
"KENT.TR","Kent Gida Maddeleri Sanayi ve Ticaret AS","Unknown","IST"
"KERVN.TR","Kervansaray Yatirim Holding AS","Unknown","IST"
"KERVT.TR","Kerevitas Gida Sanayi ve Ticaret A.S.","Unknown","IST"
"KILER.TR","Kiler Alisveris Hzmtlr Gd Sny ve Tcrt AS","Unknown","IST"
"KIPA.TR","Tesco Kp Ktl Pzrlm Trt Ljstk v Gd Sny AS","Unknown","IST"
"KLGYO.TR","Kiler Gayrimenkul Yatirim Ortakligi AS","Unknown","IST"
"KLMSN.TR","Klimasan Klima Sanayi ve Ticaret A.S.","Unknown","IST"
"KLNMA.TR","Turkiye Kalkinma Bankasi A.S.","Unknown","IST"
"KNFRT.TR","Konfrut Gida Sanayi ve Ticaret A.S.","Unknown","IST"
"KOMHL.TR","Kombassan Holding AS","Unknown","IST"
"KONYA.TR","Konya Cimento Sanayii A.S.","Unknown","IST"
"KORDS.TR","Kordsa Global End Iplik ve Kord Bezi San","Unknown","IST"
"KOZAL.TR","Koza Altin Isletmeleri AS","Unknown","IST"
"KPHOL.TR","Kapital Yatirim Holding AS","Unknown","IST"
"KRATL.TR","Karakas Atlantis Kiymetli Madenler KTSvT","Unknown","IST"
"KRDMA.TR","Kardemir Karabuk Demir Celik San. ve Tic","Unknown","IST"
"KRDMB.TR","Kardemir Karabuk Demir Celik San. ve Tic","Unknown","IST"
"KRDMD.TR","Kardemir Karabuk Demir Celik San. ve Tic","Unknown","IST"
"KRGYO.TR","Korfez Gayrimenkul Yatirim Ortakligi AS","Unknown","IST"
"KRONT.TR","Kron Telekomunikasyon Hizmetleri AS","Unknown","IST"
"KRSAN.TR","Karsusan Karadeniz Su Urunleri Sanayi AS","Unknown","IST"
"KRSTL.TR","Kristal Kola ve Mesrubat Sanayi Tic. AS","Unknown","IST"
"KRTEK.TR","Karsu Tekstil Sanayi ve Ticaret A.S.","Unknown","IST"
"KSTUR.TR","KUSTUR KUSADASI TURIZM","Unknown","IST"
"KTLME.TR","IST:KTLME","Unknown","IST"
"KUTPO.TR","Kutahya Porselen Sanayii A.S.","Unknown","IST"
"KUYAS.TR","Kuyumcukent Gayrimenkul Yatirimlari AS","Unknown","IST"
"LATEK.TR","Latek Lojistik Ticaret AS","Unknown","IST"
"LIDFA.TR","Lider Faktoring AS","Unknown","IST"
"LINK.TR","Link Blgsyr Stmlr Yzm ve Dm Sny ve Tr As","Unknown","IST"
"LKMNH.TR","Lokman Hekim Engu Sa Tu Eg Hi v In TA AS","Unknown","IST"
"LOGO.TR","Logo Yazilim Sanayi ve Ticaret A.S.","Unknown","IST"
"LUKSK.TR","Luks Kadife Ticaret ve Sanayi A.S.","Unknown","IST"
"MAALT.TR","Marmaris Altinyunus Turistik Tesisler AS","Unknown","IST"
"MAKTK.TR","Makina Takim Endustrisi A.S.","Unknown","IST"
"MANGO.TR","Mango Gida Sanayi ve Ticaret AS","Unknown","IST"
"MARTI.TR","Marti Otel Isletmeleri A.S.","Unknown","IST"
"MCTAS.TR","MCT Danismanlik AS","Unknown","IST"
"MEGAP.TR","Mega Polietilen Kopuk Sanayi","Unknown","IST"
"MEMSA.TR","Mensa Sinai Ticari ve Mali Yatirimlar AS","Unknown","IST"
"MENBA.TR","Menba Holding AS","Unknown","IST"
"MEPET.TR","Mepet Metro Petrol ve Tesisleri Sanayi","Unknown","IST"
"MERIT.TR","MERIT TURIZM","Unknown","IST"
"MERKO.TR","Merko Gida Sanayi ve Ticaret AS","Unknown","IST"
"METAL.TR","Metal Gayrimenkul AS","Unknown","IST"
"METRO.TR","Metro Ticari ve Mali Yatirimlar AS","Unknown","IST"
"METUR.TR","Metemtur Otelcilik ve Turizm Islet. A.S.","Unknown","IST"
"MGROS.TR","Migros Ticaret AS","Unknown","IST"
"MIPAZ.TR","Milpa Tcr ve Sn Urnlr Pzlm Sny ve Tcr AS","Unknown","IST"
"MMCAS.TR","MMC Sanayi ve Ticari Yatirimlar AS","Unknown","IST"
"MNDRS.TR","Menderes Tekstil Sanayi ve Ticaret A.S.","Unknown","IST"
"MRDIN.TR","Mardin Cimento Sanayii ve Ticaret A.S.","Unknown","IST"
"MRGYO.TR","Marti Gayrimenkul Yatirim Ortakligi AS","Unknown","IST"
"MRSHL.TR","Marshall Boya ve Vernik Sanayii A.S.","Unknown","IST"
"MRTGG.TR","Mert Gida Giyim Sanayi ve Ticaret A.S.","Unknown","IST"
"MUTLU.TR","Mutlu Aku ve Malzemeleri Sanayii AS","Unknown","IST"
"MZHLD.TR","Mazhar Zorlu Holding A.S.","Unknown","IST"
"NETAS.TR","Netas Telekomunikasyon AS","Unknown","IST"
"NIBAS.TR","Nigbas Nigde Beton Sanayii ve Ticaret AS","Unknown","IST"
"NTHOL.TR","Net Holding Anonim Sirketi","Unknown","IST"
"NTTUR.TR","Net Turizm Ticaret ve Sanayi A.S.","Unknown","IST"
"NUGYO.TR","Nurol Gayrimenkul Yatirim Ortakligi A.S.","Unknown","IST"
"NUHCM.TR","Nuh Cimento Sanayi A.S.","Unknown","IST"
"ODAS.TR","ODAS Elektrik Uretim Sanayi Ticaret AS","Unknown","IST"
"OLMIP.TR","Olmuksan Intl Paper Ambalj Sny v Tcrt AS","Unknown","IST"
"ORGE.TR","Orge Enerji Elektrik Taahhut AS","Unknown","IST"
"ORMA.TR","ORMA ORMAN MAHSULLERI","Unknown","IST"
"OSMEN.TR","OSMANLI MENKUL","Unknown","IST"
"OSTIM.TR","Ostim Endustriyel Yatirimlar Isletme AS","Unknown","IST"
"OTKAR.TR","Otokar Otomotiv ve Savunma Sanayi AS","Unknown","IST"
"OYAYO.TR","Oyak Yatirim Ortakligi A.S.","Unknown","IST"
"OYLUM.TR","Oylum Sinai Yatirimlar AS","Unknown","IST"
"OZBAL.TR","Ozbal Celik Boru Sanayi Ticaret ve","Unknown","IST"
"OZGYO.TR","Ozderici Gayrimenkul Yatirim Ortklg AS","Unknown","IST"
"OZKGY.TR","Ozak Gayrimenkul Yatirim Ortakligi AS","Unknown","IST"
"OZRDN.TR","Ozerden Plastik Sanayi ve Ticaret AS","Unknown","IST"
"PAGYO.TR","Panora Gayrimenkul Yatirim Ortakligi AS","Unknown","IST"
"PARSN.TR","Parsan Makina Parcalari Sanayii A.S.","Unknown","IST"
"PEGYO.TR","Pera Gayrimenkul Yatirim Ortakligi AS","Unknown","IST"
"PENGD.TR","Penguen Gida Sanayi A.S.","Unknown","IST"
"PETKM.TR","Petkim Petrokimya Holding A.S.","Unknown","IST"
"PETUN.TR","Pinar Entegre Et ve Un Sanayii AS","Unknown","IST"
"PGSUS.TR","Pegasus Hava Tasimaciligi AS","Unknown","IST"
"PIMAS.TR","Pimas Plastik Insaat Malzemeleri A.S.","Unknown","IST"
"PINSU.TR","Pinar Su Sanayi ve Ticaret A.S.","Unknown","IST"
"PKART.TR","Plastikkart Akilli Kart Iletisim Sist.","Unknown","IST"
"PKENT.TR","Petrokent Turizm A.S.","Unknown","IST"
"PLASP.TR","Plaspak Kimya Sanayi ve Ticaret AS","Unknown","IST"
"PNSUT.TR","Pinar Sut Mamulleri Sanayii A.S.","Unknown","IST"
"POLHO.TR","Polisan Holding AS","Unknown","IST"
"POLTK.TR","Politeknik Metal Sanayi ve Ticaret AS","Unknown","IST"
"PRKAB.TR","Turk Prysmian Kablo ve Sistemleri A.S.","Unknown","IST"
"PRKME.TR","Park Elektrik Uretim Mdnlk Sny v Tcrt AS","Unknown","IST"
"PRTAS.TR","CBS Printas Oto Boya ve Gerec. San. A.S.","Unknown","IST"
"PRZMA.TR","Prizma Prs Mtbaclk Yynclk Sny v Tcrt AS","Unknown","IST"
"PSDTC.TR","Pergamon-Status Dis Ticaret AS","Unknown","IST"
"PTOFS.TR","OMV Petrol Ofisi AS","Unknown","IST"
"RANLO.TR","Ran Lojistik Hizmetleri AS","Unknown","IST"
"RAYSG.TR","Ray Sigorta A.S.","Unknown","IST"
"RHEAG.TR","Rhea Girisim Sermayesi Yatirim Ortklg AS","Unknown","IST"
"RODRG.TR","Rodrigo Tekstil Sanayi ve Ticaret AS","Unknown","IST"
"ROYAL.TR","Royal Hali Iplik Tkstil Mbly Sny v Tc AS","Unknown","IST"
"RTALB.TR","RTA Laboratuvarlari Biyoljik UI v MST AS","Unknown","IST"
"RYGYO.TR","Reysas Gayrimenkul Yatirim Ortakligi AS","Unknown","IST"
"RYSAS.TR","Reysas Tasimacilik ve Lojistik Tcrt AS","Unknown","IST"
"SAFGY.TR","Saf Gayrimenkul Yatirim Ortakligi AS","Unknown","IST"
"SAHOL.TR","Haci Omer Sabanci Holding A.S.","Unknown","IST"
"SAMAT.TR","Saray Matbaacilik KK Ticaret v Sanayi AS","Unknown","IST"
"SANEL.TR","SAN-EL Muhendislik Elektrik Taahhut San","Unknown","IST"
"SANFM.TR","Sanifoam Sunger Sanayi ve Ticaret AS","Unknown","IST"
"SANKO.TR","Sanko Pazarlama Ithalat Ihracat AS","Unknown","IST"
"SARKY.TR","Sarkuysan Elektrolitik Bakir Sanayii AS","Unknown","IST"
"SASA.TR","SASA Polyester Sanayi AS","Unknown","IST"
"SAYAS.TR","Say Reklamcilik Yapi Dekorasyon Proje","Unknown","IST"
"SEKFK.TR","Seker Finansal Kiralama A.S.","Unknown","IST"
"SEKUR.TR","Sekuro Plastik Ambalaj Sanayi AS","Unknown","IST"
"SELEC.TR","Selcuk Ecza Deposu Ticaret ve Sanayi AS","Unknown","IST"
"SELGD.TR","Selcuk Gida Endustri Ihracat Ithalat AS","Unknown","IST"
"SERVE.TR","Serve Kirtasiye San. ve Tic. AS","Unknown","IST"
"SEYKM.TR","Seyitler Kimya Sanayi AS","Unknown","IST"
"SILVR.TR","Silverline Endustri ve Ticaret A.S.","Unknown","IST"
"SISE.TR","Turkiye Sise ve Cam Fabrikalari A.S.","Unknown","IST"
"SKBNK.TR","Sekerbank T.A.S.","Unknown","IST"
"SKPLC.TR","Seker Pilic ve Yem Sanayi Ticaret A.S.","Unknown","IST"
"SKTAS.TR","Soktas Tekstil Sanayi ve Ticaret A.S.","Unknown","IST"
"SLVRP.TR","IST:SLVRP","Unknown","IST"
"SNGYO.TR","Sinpas Gayrimenkul Yatirim Ortakligi A.S","Unknown","IST"
"SNKRN.TR","Senkron Guvenlik ve Iletisim Sistemlr AS","Unknown","IST"
"SNPAM.TR","Sonmez Pamuklu Sanayii A.S.","Unknown","IST"
"SODA.TR","Soda Sanayii A.S.","Unknown","IST"
"SODSN.TR","SODAS SODYUM SANAYII","Unknown","IST"
"SONME.TR","Sonmez Filament Sentetik Iplik ve Elyaf","Unknown","IST"
"SRVGY.TR","Servet Gayrimenkul Yatirim Ortakligi AS","Unknown","IST"
"TACTR.TR","Tac Tarim Urunleri Hayvancilik","Unknown","IST"
"TARAF.TR","TARAF GAZETECILIK","Unknown","IST"
"TATGD.TR","Tat Gida Sanayi AS","Unknown","IST"
"TAVHL.TR","Tav Havalimanlari Holding A.S.","Unknown","IST"
"TBORG.TR","Turk Tuborg Bira ve Malt Sanayii A.S.","Unknown","IST"
"TCELL.TR","Turkcell Iletisim Hizmetleri A.S.","Unknown","IST"
"TCHOL.TR","Tacirler Yatirim Holding AS","Unknown","IST"
"TEBNK.TR","Turk Ekonomi Bankasi AS","Unknown","IST"
"TEKTU.TR","Tek Art Insaat Ticaret Tur San ve Yat AS","Unknown","IST"
"TGSAS.TR","TGS Dis Ticaret AS","Unknown","IST"
"THYAO.TR","Turk Hava Yollari AO","Unknown","IST"
"TIRE.TR","Mondi Tire Kutsan Kagit ve Ambalaj San","Unknown","IST"
"TKFEN.TR","Tekfen Holding A.S.","Unknown","IST"
"TKNSA.TR","Teknosa Ic ve Dis Ticaret AS","Unknown","IST"
"TKURU.TR","Taze Kuru Gida Sanayi ve Ticaret AS","Unknown","IST"
"TMPOL.TR","Temapol Polimer Plstk v Inst Sny Tcrt AS","Unknown","IST"
"TMSN.TR","Tumosan Motor ve Traktor Sanayi AS","Unknown","IST"
"TOASO.TR","Tofas Turk Otomobil Fabrikasi A.S.","Unknown","IST"
"TRCAS.TR","Turcas Petrol A. S.","Unknown","IST"
"TRGYO.TR","Torunlar Gayrimenkul Yatirim Ortaklig AS","Unknown","IST"
"TRKCM.TR","Trakya Cam Sanayii AS","Unknown","IST"
"TRNSK.TR","Transturk Holding A.S.","Unknown","IST"
"TSGYO.TR","TSKB Gayrimenkul Yatirim Ortakligi AS","Unknown","IST"
"TSKB.TR","Turkiye Sinai Kalkinma Bankasi A.S.","Unknown","IST"
"TSPOR.TR","Trabzonspor Sprtf Ytrm Ftbl Isltmclg Tct","Unknown","IST"
"TTKOM.TR","Turk Telekomunikasyon A.S.","Unknown","IST"
"TTRAK.TR","Turk Traktor ve Ziraat Makineleri AS","Unknown","IST"
"TUCLK.TR","Tugcelik Aluminyum ve Metal Mamulleri","Unknown","IST"
"TUDDF.TR","Turk Demir Dokum Fabrikalari A.S.","Unknown","IST"
