"Code","Symbol","Industry","Board"
"TUKAS.TR","Tukas Gida Sanayi ve Ticaret AS","Unknown","IST"
"TUPRS.TR","Turkiye Petrol Rafinerileri A.S.","Unknown","IST"
"TURGG.TR","Turker Proje Gayrimnkl Ve Ytrm Glstrm AS","Unknown","IST"
"TURSP.TR","IST:TURSP","Unknown","IST"
"UFUK.TR","Fon Sinai Yatirimlar AS","Unknown","IST"
"ULAS.TR","Ulaslar Turizm Yatirimlari","Unknown","IST"
"ULKER.TR","Ulker Biskuvi Sanayi A.S.","Unknown","IST"
"ULUSE.TR","Ulusoy Elektrik Imalat Taahhut v Tcrt AS","Unknown","IST"
"ULUUN.TR","Ulusoy Un Sanayi Ve Ticaret AS","Unknown","IST"
"UMPAS.TR","UMPAS HOLDING","Unknown","IST"
"UNICO.TR","Unico Sigorta AS","Unknown","IST"
"UNYEC.TR","Unye Cimento Sanayi ve Ticaret A.S.","Unknown","IST"
"USAK.TR","Usak Seramik Sanayi AS","Unknown","IST"
"USAS.TR","USAS Yatirimlar Holding AS","Unknown","IST"
"USDTR.TR","IST:USDTR","Unknown","IST"
"UTPYA.TR","Utopya Turizm Insaat Isletmecilik AS","Unknown","IST"
"UYUM.TR","Uyum Gida Ihtiyac Maddeleri Sanayi","Unknown","IST"
"UZERB.TR","UZERTAS BOYA","Unknown","IST"
"VAKBN.TR","Turkiye Vakiflar Bankasi T.A.O.","Unknown","IST"
"VAKFN.TR","Vakif Finansal Kiralama A.S.","Unknown","IST"
"VAKKO.TR","Vakko Tekstil ve Hazir Giyim Sanayi Isl.","Unknown","IST"
"VANGD.TR","Vanet Gida Sanayi Ic ve Dis Ticaret AS","Unknown","IST"
"VERTU.TR","Verusaturk Girisim Sermayesi Yrm Otkg AS","Unknown","IST"
"VERUS.TR","Verusa Holding AS","Unknown","IST"
"VESBE.TR","Vestel Beyaz Esya Sanayi ve Ticaret A.S.","Unknown","IST"
"VESTL.TR","Vestel Elektronik Sanayi ve Ticaret AS","Unknown","IST"
"VIAGO.TR","Via Gayrimenkul Yatirim Ortakligi AS","Unknown","IST"
"VKFYO.TR","Vakif Menkul Kiymet Yatirim Ortakligi AS","Unknown","IST"
"VKGYO.TR","Vakif Gayrimenkul Yatirim Ortakligi A.S.","Unknown","IST"
"VKING.TR","Viking Kagit ve Seluloz A.S.","Unknown","IST"
"YAPRK.TR","Yaprak Sut ve Besi Ciftlikleri","Unknown","IST"
"YATAS.TR","Yatas Yatak ve Yorgan Sanayi Ticaret AS","Unknown","IST"
"YAYLA.TR","Yayla Enrji Urtm Turzm ve Inst Ticart AS","Unknown","IST"
"YAZIC.TR","Yazicilar Holding AS","Unknown","IST"
"YBTAS.TR","YIBITAS INSAAT MALZEME","Unknown","IST"
"YESIL.TR","Yesil Yatirim Holding AS","Unknown","IST"
"YGGYO.TR","Yeni Gimat Gayrimenkul Yatirim Ortakg AS","Unknown","IST"
"YGYO.TR","Yesil Gayrimenkul Yatirim Ortakligi AS","Unknown","IST"
"YKBNK.TR","Yapi ve Kredi Bankasi A.S.","Unknown","IST"
"YKBYO.TR","Yapi Kredi B Tipi Yatirim Ortakligi AS","Unknown","IST"
"YKGYO.TR","Yapi Kredi Koray Gayrimenkul Yat. Ort.","Unknown","IST"
"YKSGR.TR","Yapi Kredi Sigorta A.S.","Unknown","IST"
"YONGA.TR","YONGA MOBILYA","Unknown","IST"
"YUNSA.TR","Yunsa Yunlu Sanayi ve Ticaret AS","Unknown","IST"
"YYAPI.TR","Yesil Yapi Endustrisi AS","Unknown","IST"
"ZOREN.TR","Zorlu Enerji Elektrik Uretim A.S.","Unknown","IST"
